{
  "capabilities": [
    "attack_path_analysis",
    "cross_boundary_correlation",
    "evidence_correlation",
    "identity_analysis",
    "timeline_reconstruction"
  ],
  "difficulty": "advanced",
  "episode_id": "gcp-cloud-012",
  "investigation_shapes": [
    "ambiguous_alternative",
    "cross_boundary",
    "multi_stage"
  ],
  "schema_version": "0.6"
}
